{
  "schema_version": "codevetter.context-provider-plan.v1",
  "experiment_id": "code-context-provider-comparison",
  "stage": "feasibility",
  "corpus": {
    "path": "benchmarks/agent-tasks/sample/corpus.json",
    "sha256": "1cf937c2bbd73d39702bf122f8afe5bd255ebd780480b93aab46defc099b9b52"
  },
  "corpus_id": "codevetter-agent-task-contract-sample",
  "corpus_version": "0.3.0",
  "agent_profile": {
    "status": "selected",
    "agent": "CodeVetter local context experiment adapter",
    "model": "mlx-community/Qwen3-4B-Instruct-2507-4bit@50d427756c6b1b2fe0c0a10f67fbda1fc8e82c1b",
    "adapter": {
      "path": "benchmarks/context-providers/adapters/local-qwen-context.json",
      "sha256": "eaacb10e8d305416fd91e2a5df17330042febf01cc23b68e97377098a3c4699e"
    },
    "configuration_sha256": "eaacb10e8d305416fd91e2a5df17330042febf01cc23b68e97377098a3c4699e",
    "environment_sha256": "c48e7c6e65827ad143c8b8ddc6ec762bf6fa82f50d5bb582f86bac679268b5c4",
    "cost_posture": "free",
    "max_usd_per_attempt": 0
  },
  "provider_probes": [
    {
      "path": "benchmarks/context-providers/stage0/probes/codevetter-structural-context.json",
      "sha256": "75bd14d35c586edff505fc29c3b053c3f9e172d64fe3520af370874e3925f433"
    },
    {
      "path": "benchmarks/context-providers/stage0/probes/plain-repository-tools.json",
      "sha256": "da196bec1e2e4a9119dae57c557ddee04a4f5204740d4f8ba3a01c32785f2052"
    }
  ],
  "providers": [
    {
      "provider_id": "codevetter-structural-context",
      "provider_version": "1.7.0",
      "configuration_sha256": "98df90f91250dbe8462446ea5096055922e30745afdccefeb412c8d723584336",
      "probe_sha256": "75bd14d35c586edff505fc29c3b053c3f9e172d64fe3520af370874e3925f433",
      "role": "treatment",
      "context_kind": "graph",
      "interface_kind": "cli",
      "operating_mode": "local",
      "data_egress": "none",
      "cost_posture": "free",
      "max_usd_per_attempt": 0,
      "environment_names": [],
      "allowed_tools": [
        "graph_query"
      ],
      "snapshots": [
        {
          "status": "ready",
          "snapshot_id": "snapshot:69e5a735a9fdf1fd",
          "indexed_revision": "7a3dd934f68f4927b66d9e8b8ed317f8ba369aa3",
          "task_id": "accept-zero-duration",
          "source_sha256": "1e282709e1f71ed2663dc0696bcfa5f9ce1041137bf3a101210398d99bb0a316"
        },
        {
          "status": "ready",
          "snapshot_id": "snapshot:404e574b7280c177",
          "indexed_revision": "7a3dd934f68f4927b66d9e8b8ed317f8ba369aa3",
          "task_id": "await-transaction-commit",
          "source_sha256": "32947bf9422aa91c938a5aa5a6ebe78ffdec2aae84b5de4d766c6dd863a88922"
        },
        {
          "status": "ready",
          "snapshot_id": "snapshot:6d77475bc9609b9a",
          "indexed_revision": "7a3dd934f68f4927b66d9e8b8ed317f8ba369aa3",
          "task_id": "deduplicate-visible-items",
          "source_sha256": "e5e53e72734c3ce5d65933566eae3b67a24ed2f4b7cb032bb8a7364c33ea47aa"
        },
        {
          "status": "ready",
          "snapshot_id": "snapshot:43fb6593e8fab42d",
          "indexed_revision": "7a3dd934f68f4927b66d9e8b8ed317f8ba369aa3",
          "task_id": "ignore-stale-search-response",
          "source_sha256": "222332005de577e469d2bda16cbfc8b2aab96540f392ddd15b6b99b1b600cddf"
        }
      ]
    },
    {
      "provider_id": "plain-repository-tools",
      "provider_version": "builtin-1",
      "configuration_sha256": "7ecedd57a9b43e8450a0b1f242382c1feb75ad4725ff9ab9fbc447aa796bc491",
      "probe_sha256": "da196bec1e2e4a9119dae57c557ddee04a4f5204740d4f8ba3a01c32785f2052",
      "role": "baseline",
      "context_kind": "baseline",
      "interface_kind": "none",
      "operating_mode": "local",
      "data_egress": "none",
      "cost_posture": "free",
      "max_usd_per_attempt": 0,
      "environment_names": [],
      "allowed_tools": [],
      "snapshots": []
    }
  ],
  "tasks": [
    {
      "task_id": "accept-zero-duration",
      "manifest_sha256": "dfc212aba38b530c55b28d3f5fef11403b8f753d853f311f66e8797ec5f12a27",
      "fixture_sha256": "1e282709e1f71ed2663dc0696bcfa5f9ce1041137bf3a101210398d99bb0a316",
      "repository_revision": "7a3dd934f68f4927b66d9e8b8ed317f8ba369aa3",
      "lane": "api",
      "runtime": "typescript",
      "category": "validation"
    },
    {
      "task_id": "await-transaction-commit",
      "manifest_sha256": "52054adb14f8e18189de6516a288f6dfc751b54f7d7b87d180c8cebcfc371aed",
      "fixture_sha256": "32947bf9422aa91c938a5aa5a6ebe78ffdec2aae84b5de4d766c6dd863a88922",
      "repository_revision": "7a3dd934f68f4927b66d9e8b8ed317f8ba369aa3",
      "lane": "api",
      "runtime": "typescript",
      "category": "persistence"
    },
    {
      "task_id": "deduplicate-visible-items",
      "manifest_sha256": "ce90f407cb7546cce2d559efff8a2e53f07355f754516da26a212946b86a5f52",
      "fixture_sha256": "e5e53e72734c3ce5d65933566eae3b67a24ed2f4b7cb032bb8a7364c33ea47aa",
      "repository_revision": "7a3dd934f68f4927b66d9e8b8ed317f8ba369aa3",
      "lane": "browser",
      "runtime": "node",
      "category": "regression"
    },
    {
      "task_id": "ignore-stale-search-response",
      "manifest_sha256": "64e300cfb46489761b783df3af1efa0f07b112dbd22d9b0f2a64a6fa507a72db",
      "fixture_sha256": "222332005de577e469d2bda16cbfc8b2aab96540f392ddd15b6b99b1b600cddf",
      "repository_revision": "7a3dd934f68f4927b66d9e8b8ed317f8ba369aa3",
      "lane": "browser",
      "runtime": "typescript",
      "category": "concurrency"
    }
  ],
  "repetitions": 2,
  "schedule": [
    {
      "sequence": 1,
      "task_id": "accept-zero-duration",
      "trial_index": 1,
      "provider_id": "codevetter-structural-context",
      "order": 1
    },
    {
      "sequence": 2,
      "task_id": "accept-zero-duration",
      "trial_index": 1,
      "provider_id": "plain-repository-tools",
      "order": 2
    },
    {
      "sequence": 3,
      "task_id": "accept-zero-duration",
      "trial_index": 2,
      "provider_id": "plain-repository-tools",
      "order": 1
    },
    {
      "sequence": 4,
      "task_id": "accept-zero-duration",
      "trial_index": 2,
      "provider_id": "codevetter-structural-context",
      "order": 2
    },
    {
      "sequence": 5,
      "task_id": "await-transaction-commit",
      "trial_index": 1,
      "provider_id": "plain-repository-tools",
      "order": 1
    },
    {
      "sequence": 6,
      "task_id": "await-transaction-commit",
      "trial_index": 1,
      "provider_id": "codevetter-structural-context",
      "order": 2
    },
    {
      "sequence": 7,
      "task_id": "await-transaction-commit",
      "trial_index": 2,
      "provider_id": "codevetter-structural-context",
      "order": 1
    },
    {
      "sequence": 8,
      "task_id": "await-transaction-commit",
      "trial_index": 2,
      "provider_id": "plain-repository-tools",
      "order": 2
    },
    {
      "sequence": 9,
      "task_id": "deduplicate-visible-items",
      "trial_index": 1,
      "provider_id": "codevetter-structural-context",
      "order": 1
    },
    {
      "sequence": 10,
      "task_id": "deduplicate-visible-items",
      "trial_index": 1,
      "provider_id": "plain-repository-tools",
      "order": 2
    },
    {
      "sequence": 11,
      "task_id": "deduplicate-visible-items",
      "trial_index": 2,
      "provider_id": "plain-repository-tools",
      "order": 1
    },
    {
      "sequence": 12,
      "task_id": "deduplicate-visible-items",
      "trial_index": 2,
      "provider_id": "codevetter-structural-context",
      "order": 2
    },
    {
      "sequence": 13,
      "task_id": "ignore-stale-search-response",
      "trial_index": 1,
      "provider_id": "plain-repository-tools",
      "order": 1
    },
    {
      "sequence": 14,
      "task_id": "ignore-stale-search-response",
      "trial_index": 1,
      "provider_id": "codevetter-structural-context",
      "order": 2
    },
    {
      "sequence": 15,
      "task_id": "ignore-stale-search-response",
      "trial_index": 2,
      "provider_id": "codevetter-structural-context",
      "order": 1
    },
    {
      "sequence": 16,
      "task_id": "ignore-stale-search-response",
      "trial_index": 2,
      "provider_id": "plain-repository-tools",
      "order": 2
    }
  ],
  "counts": {
    "providers": 2,
    "tasks": 4,
    "repetitions": 2,
    "attempts": 16
  },
  "cost": {
    "posture": "free",
    "context_max_usd": 0,
    "agent_max_usd": 0,
    "total_max_usd": 0
  },
  "environment": [
    {
      "name": "CODEVETTER_LOCAL_MODEL_URL",
      "available": true
    }
  ],
  "approvals": {
    "execution_required": true,
    "paid_required": false,
    "hosted_required": false,
    "data_egress_required": false,
    "approval_id": "approval-0bd3cf8c18706ffd739bcff4d8aa4acf"
  },
  "blocked_reasons": [],
  "diagnostics": [
    "agent-cost",
    "context-tool-calls",
    "files-inspected",
    "files-modified",
    "input-tokens",
    "output-tokens"
  ],
  "limitations": [
    "Stage 0 creates plans and capability evidence only; it does not launch providers or agents.",
    "A provider capability probe is not evidence of agent-quality improvement.",
    "Hidden executable checks remain the outcome authority for any later execution."
  ],
  "plan_id": "plan-fd924b482cd13928579a84eebacf36b2"
}
